{
  "SchemaVersion": "1.0",
  "WaveId": "LAB-001-WAVE4",
  "ContractStatus": "VALIDATED_FOUNDATION",
  "RuntimeStatus": "NOT_EXECUTED",
  "DataClassification": "SYNTHETIC",
  "TopologyProfiles": [
    {
      "ProfileId": "W4-CTR-SINGLE",
      "TopologyId": "CTR-SINGLE",
      "RequiredRoles": [
        "SQL_PRIMARY",
        "OBSERVER"
      ],
      "NetworkSegments": [
        "LAB_MANAGEMENT",
        "LAB_DATA"
      ],
      "ManagementPathIndependent": true,
      "MaximumSqlNodes": 1,
      "FaultLayer": "OPTIONAL",
      "RuntimeImplementationStatus": "PLANNED_NOT_IMPLEMENTED",
      "CleanupPolicy": "REGISTERED_OBJECT_IDS_ONLY"
    },
    {
      "ProfileId": "W4-CTR-PAIR",
      "TopologyId": "CTR-PAIR",
      "RequiredRoles": [
        "SQL_PRIMARY",
        "SQL_SECONDARY",
        "OBSERVER"
      ],
      "NetworkSegments": [
        "LAB_MANAGEMENT",
        "LAB_DATA"
      ],
      "ManagementPathIndependent": true,
      "MaximumSqlNodes": 2,
      "FaultLayer": "OPTIONAL",
      "RuntimeImplementationStatus": "PLANNED_NOT_IMPLEMENTED",
      "CleanupPolicy": "REGISTERED_OBJECT_IDS_ONLY"
    },
    {
      "ProfileId": "W4-CTR-TRIPLE",
      "TopologyId": "CTR-TRIPLE",
      "RequiredRoles": [
        "SQL_PRIMARY",
        "SQL_SECONDARY",
        "SQL_TERTIARY",
        "OBSERVER"
      ],
      "NetworkSegments": [
        "LAB_MANAGEMENT",
        "LAB_DATA"
      ],
      "ManagementPathIndependent": true,
      "MaximumSqlNodes": 3,
      "FaultLayer": "OPTIONAL",
      "RuntimeImplementationStatus": "PLANNED_NOT_IMPLEMENTED",
      "CleanupPolicy": "REGISTERED_OBJECT_IDS_ONLY"
    },
    {
      "ProfileId": "W4-HV-CROSS-PLATFORM-FAULT",
      "TopologyId": "HV-CROSS-PLATFORM",
      "RequiredRoles": [
        "WINDOWS_SQL_PRIMARY",
        "LINUX_SQL_SECONDARY",
        "OBSERVER",
        "NETWORK_FAULT"
      ],
      "NetworkSegments": [
        "LAB_MANAGEMENT",
        "LAB_DATA",
        "LAB_FAULT"
      ],
      "ManagementPathIndependent": true,
      "MaximumSqlNodes": 2,
      "FaultLayer": "REQUIRED",
      "RuntimeImplementationStatus": "PLANNED_NOT_IMPLEMENTED",
      "CleanupPolicy": "REGISTERED_OBJECT_IDS_ONLY"
    }
  ],
  "ExternalEvidenceGates": [
    {
      "GateId": "LAB-GATE-WAVE4-MULTI-CONTAINER",
      "RequiredPlatform": "CONTAINER_LINUX",
      "RequiredCapability": "MULTI_CONTAINER_NETWORK",
      "Status": "NOT_EXECUTED",
      "EvidencePolicy": "SYNTHETIC_SUMMARY_ONLY"
    },
    {
      "GateId": "LAB-GATE-WAVE4-NETWORK-FAULT",
      "RequiredPlatform": "ISOLATED_SELF_HOSTED_LINUX_OR_HYPER_V_LINUX",
      "RequiredCapability": "NETWORK_FAULT_LAYER",
      "Status": "NOT_EXECUTED",
      "EvidencePolicy": "SYNTHETIC_SUMMARY_ONLY"
    }
  ]
}
